{
  "id": "2026-08-28-idempotency",
  "date": "2026-08-28",
  "title": "Idempotency",
  "category": "system-design",
  "lesson": "An operation is idempotent if performing it multiple times has the same effect as performing it once. This matters constantly in distributed systems because networks are unreliable: a client sends a request, the server processes it successfully, but the response is lost before it reaches the client. The client, having no way to know the request actually succeeded, retries. Without idempotency, that retry can cause real damage, like charging a customer's card twice or creating two duplicate orders from what was meant to be a single purchase.\n\nHTTP gives idempotency a formal home. GET, PUT, and DELETE are defined as idempotent: fetching a resource repeatedly doesn't change it, and setting a resource to a given state or deleting it produces the same end state whether done once or five times. POST is not idempotent by default, because it's typically used to create a new resource or trigger an action, and doing that twice usually means two results instead of one. This is exactly why naive retry logic is dangerous for POST requests in particular, and why systems that need retryable creation or payment-style actions need an explicit mechanism beyond just relying on the HTTP method.\n\nThe common mechanism is an idempotency key: the client generates a unique token (often a UUID) for a single logical operation and sends it along with the request, typically in a header. The server, on first seeing that key, processes the request normally and stores the key alongside the result. If the same key arrives again, whether because the client never got the original response or because it retried defensively, the server recognizes it's already handled that exact operation and returns the previously stored result without reprocessing, rather than creating a second charge or a second order. Keys are usually scoped with a time-to-live, since a client isn't expected to retry the same logical operation indefinitely.\n\nIdempotency and retries are complementary, not competing patterns: retries with backoff give a client a way to recover from transient failures, but they're only safe to use freely once the operation being retried is known to be idempotent. Making an endpoint idempotent is what turns \"retry and hope for the best\" into a genuinely safe strategy, which is why idempotency keys show up heavily in payment APIs, order-creation endpoints, and any other POST-driven action where a duplicate has real-world consequences."
  ,
  "questions": [
    {
      "id": "q1",
      "type": "mcq",
      "prompt": "Which of these HTTP methods is NOT idempotent by definition?",
      "options": [
        "GET",
        "PUT",
        "DELETE",
        "POST"
      ],
      "answer": 3,
      "explanation": "POST typically creates a new resource or triggers an action, so repeating it usually produces a second effect rather than the same end state."
    },
    {
      "id": "q2",
      "type": "true_false",
      "prompt": "An idempotent operation can only be safely called a single time.",
      "answer": false,
      "explanation": "The opposite is true: idempotency means an operation can be called any number of times and still produce the same result as calling it once."
    },
    {
      "id": "q3",
      "type": "fill_blank",
      "prompt": "To make a non-idempotent POST endpoint safely retryable, a client sends a unique token with each logical operation, commonly called an idempotency ____.",
      "answer": "key",
      "acceptable": ["idempotency key"],
      "explanation": "The server stores the key alongside the result of the first request, so a duplicate request with the same key returns the stored result instead of reprocessing."
    },
    {
      "id": "q4",
      "type": "mcq",
      "prompt": "A client sends a payment request with idempotency key 'abc123', the server processes it and the response is lost in transit. The client retries with the same key. What should the server do?",
      "options": [
        "Charge the customer again since a new request arrived",
        "Reject the retry with an error",
        "Return the result of the original request without charging again",
        "Queue the request until a human reviews it"
      ],
      "answer": 2,
      "explanation": "Recognizing the previously seen key lets the server return the already-computed result instead of performing the payment a second time."
    },
    {
      "id": "q5",
      "type": "true_false",
      "prompt": "Retries with backoff are always safe to apply to any request, regardless of whether the underlying operation is idempotent.",
      "answer": false,
      "explanation": "Retries are only safe to apply freely once the operation being retried is known to be idempotent; retrying a non-idempotent action can duplicate its effect."
    },
    {
      "id": "q6",
      "type": "ordering",
      "prompt": "Order these steps as a server handles a POST request carrying an idempotency key, from first request through a duplicate retry.",
      "items": [
        "A duplicate request arrives with the same idempotency key",
        "The client sends the original request with a newly generated idempotency key",
        "The server returns the stored result without reprocessing the operation",
        "The server processes the request and stores the result alongside the key"
      ],
      "answer": [1, 3, 0, 2],
      "explanation": "The client attaches a fresh key to the original request, the server processes it once and stores the outcome, and any later request with that same key just gets the stored result returned."
    }
  ]
}
